,순위,책이름,저자,줄거리
0,1,보라선 열차와 사라진 아이들,디파 아나파라,"“얼마 전까지 나는 그냥 학생이었지만, 지금은 탐정이자… 찻집 종업원이다.”인도 빈민가에서 잇따르는 아동 실종 사건, 어린이 탐정단이 수사에 나서다!2021 에드거 상 수상작인도 빈민가에서 잇따르는 아동 실종 사건을 수사하는 어린이 탐정단의 이야기를 그린 『보라선 열차와 사라진 아이들』은 인도 출신 영국 작가인 디파 아나파라의 데뷔작으로, 뭄바이와 델리 등에서 저널리스트로 일하던 당시의 경험과 인도에서 나고 자란 기억을 바탕으로 쓴 소설이다. 디파 아나파라는 집필 중이던 이 작품의 앞부분만으로 브리드포트 페기채프먼-앤드루스 상과 루시케번디시 소설상, 데버라로저스 재단 문학상을 수상했으며, 이후 장편으로 완성한 『보라선 열차와 사라진 아이들』이 2021년 .."
1,2,침대에서 담배를 피우는 것은 위험하다,마리아나 엔리케스,"라틴아메리카 환상 문학의 새로운 지평을 연 엔리케스의 대표작2021 부커 인터내셔널상 최종 후보작전 세계가 열광한 공포 단편 소설집2021년 부커 인터내셔널상 최종후보에 오르며 21세기 에드거 엘런 포, 셜리 잭슨·보르헤스의 계보를 잇는다는 평가를 받은, 마리아나 엔리케스의 소설집 『침대에서 담배를 피우는 것은 위험하다』가 출간되었다. 대체불가능한 독보적 스타일의 소유자인 엔리케스는 정치적, 역사적, 실존적 차원이 뒤섞인 공포와 두려움을 독특한 메타포로 구성하고 평온해 보이는 우리의 삶을 불확실성이라는 극단으로 끌고 가는 작품을 쓴다. 특히 이번 소설집에서는 현대 아르헨티나를 배경으로 고통과 두려움, 교착 상태에 빠진 사람들을 불러와 고딕 스릴러 특유의 차갑고 끈적.."
2,3,아처,파울로 코엘료,"전 세계 3억 2천만 독자의 마음을 움직인 작가 파울로 코엘료『연금술사』 이후 20년, 의미 있는 삶을 위한 마음 수련법 “무언가를 멀리 쏘아 보내는 동작은 역설적이게도궁사 자신에게 돌아와 자아를 마주하게 한다.시처럼 풍부한 은유 속에 녹아든 우아하고 의미 있는 삶을 위한 마음가짐최고의 자리에서 한 걸음 더 나아가 영혼의 평정에 이르는 소중한 삶의 지혜 전 세계 수많은 독자들의 ‘인생 책’으로 손꼽히며 “기막히게 멋진 영혼의 모험”을 그려낸 『연금술사』의 한국어판 출간 20주년이 되는 2021년, 파울로 코엘료는 8월 11일 출간되는 『아처THE ARCHER』로 또한번 한국 독자들의 마음을 움직인다. 『아처』는 전설적인 궁사 ‘진’이 그에게 도전해온 이방인과 대결을 펼치고, 그 과정을 지켜보던 소년에게 활쏘.."
3,4,열린책들 창립 35주년 기념 세계문학 중단편세트,"프란츠 카프카, 알베르 카뮈, 다자이 오사무, 에드거 앨런 포, 레프 니콜라예비치 톨스토이, 기 드.. 외 4명","열린책들 창립 35주년 기념세계문학 중단편 한정판 세트 출간열린책들이 올해로 창립 35주년을 맞았다. 1986년 1월 7일 러시아 문학 전문 출판사로 출범한 열린책들은 점차 유럽 문학을 비롯해 인문학 분야까지 목록을 확장하면서 2,000여 종의 책을 발행해 왔다.창립 35주년을 맞아 열린책들에서 출간하는 이번 기념 세트는, 특별히 열린책들이 출간해 온 세계문학 시리즈를 바탕으로 세계문학의 중단편 명작들을 엄선한 것이다. 누구나 한 번쯤은 꼭 읽어 봐야 할 고전, 그중에서도 부담 없이 읽을 수 있는 분량의 중단편 고전들을 선정하여 모든 독자들이 독서용으로, 선물용으로 부담 없이 선택할 수 있는 알찬 세트를 만들고자 했다. 수많은 고전들 중에서도 특히 걸작으로 평가받는 대표작 총 20권의 작품을 엄선했으며, 1.."
4,5,열린책들 창립 35주년 기념 세계문학 중단편세트,"앙투안 드 생텍쥐페리, 조지 오웰, 어니스트 헤밍웨이, 버지니아 울프, 오스카 와일드, 토마스 만 외 4명","열린책들 창립 35주년 기념세계문학 중단편 한정판 세트 출간열린책들이 올해로 창립 35주년을 맞았다. 1986년 1월 7일 러시아 문학 전문 출판사로 출범한 열린책들은 점차 유럽 문학을 비롯해 인문학 분야까지 목록을 확장하면서 2,000여 종의 책을 발행해 왔다.창립 35주년을 맞아 열린책들에서 출간하는 이번 기념 세트는, 특별히 열린책들이 출간해 온 세계문학 시리즈를 바탕으로 세계문학의 중단편 명작들을 엄선한 것이다. 누구나 한 번쯤은 꼭 읽어 봐야 할 고전, 그중에서도 부담 없이 읽을 수 있는 분량의 중단편 고전들을 선정하여 모든 독자들이 독서용으로, 선물용으로 부담 없이 선택할 수 있는 알찬 세트를 만들고자 했다. 수많은 고전들 중에서도 특히 걸작으로 평가받는 대표작 총 20권의 작품을 엄선했으며, 1.."
5,6,일곱 번째 달 일곱 번째 밤,"켄 리우, 왕콴유, 홍지운, 남유하, 남세오, 후지이 다이요, 곽재식, 이영인, 윤여경, 이경희","신비의 섬 제주, 중국, 일본의 옛이야기가 경이로운 SF로 탄생하다!한ㆍ중ㆍ일 아시아 설화 SF 프로젝트켄 리우 작가의 놀라운 상상력으로 재탄생한 칠월칠석 이야기 수록불멸의 존재들이 진홍색, 자주색, 붉은색을 띤 청색과 그 사이의 모든 색조로 끝없이 수놓은 다채롭고 아름다운 이야기‘신들의 고향’이라 불리는, 1만 8천여 개의 구비서사가 살아 숨 쉬는 신비의 섬 제주 그리고 중국과 일본의 설화를 경이로운 SF 세계관으로 새롭게 쓴 앤솔로지. 중국계 미국인이자 세계적인 SF 작가인 켄 리우가 칠월칠석 이야기를 현대적으로 완전히 바꾸어 쓴 이야기를 수록했다. 현대 중국 어느 소도시의 한여름 밤, 이별을 앞둔 십 대 연인의 사랑을 옛이야기와 연결해 놀라운 상상력으로 새로 쓴 작품이다. 한국의 SF 작가 7인은 세계.."
6,7,돈키호테 1,미구엘 드 세르반테스,"국내 최초 『돈키호테』 살바도르 달리 에디션 출간살바도르 달리의 컬러+흑백 삽화 54점 수록『돈키호테』 살바도르 달리 에디션은 최초의 근대소설이자 세계문학사상 가장 위대한 작품 『돈키호테』와 20세기 초현실주의 미술의 거장 살바도르 달리의 컬래버레이션이다. 『돈키호테 1』의 삽화들은 1946년 미국 랜덤하우스 출판사에서 출간된 『명성이 자자한 라만차의 돈키호테의 일생과 업적 제1부』에 실렸던 작품들로, 컬러 수채화 10점과 드로잉 32점을 포함한다. 『돈키호테 2』의 삽화들은 1957년 프랑스 파리의 미술전문 출판인 조셉 포레가 출간한 『라만차의 돈키호테』에 실린 것으로, 달리가 직접 제작한 12점의 석판화 작품들이다. 세계문학사상 가장 기상천외하고 독보.."
7,8,돈키호테 2,미구엘 드 세르반테스,"국내 최초 『돈키호테』 살바도르 달리 에디션 출간살바도르 달리의 컬러+흑백 삽화 54점 수록『돈키호테』 살바도르 달리 에디션은 최초의 근대소설이자 세계문학사상 가장 위대한 작품 『돈키호테』와 20세기 초현실주의 미술의 거장 살바도르 달리의 컬래버레이션이다. 『돈키호테 1』의 삽화들은 1946년 미국 랜덤하우스 출판사에서 출간된 『명성이 자자한 라만차의 돈키호테의 일생과 업적 제1부』에 실렸던 작품들로, 컬러 수채화 10점과 드로잉 32점을 포함한다. 『돈키호테 2』의 삽화들은 1957년 프랑스 파리의 미술전문 출판인 조셉 포레가 출간한 『라만차의 돈키호테』에 실린 것으로, 달리가 직접 제작한 12점의 석판화 작품들이다. 세계문학사상 가장 기상천외하고 독보.."
8,9,연금술사 세트,파울로 코엘료,"전 세계 8천 5백만 독자를 사로잡은 『연금술사』 한국어판 100쇄 출간 기념작가 친필 사인 인쇄본ㆍ명문장 노트ㆍ풀커버 구성 한정판 세트 전 세계 170개국 이상 82개 언어로 번역되어 2억 3천만 부가 넘는 판매를 기록한 우리 시대 가장 사랑받는 작가 파울로 코엘료. 그를 세계적인 작가의 반열에 오르게 한 베스트셀러 『연금술사』의 국내 100쇄 출간을 맞아, 새로운 디자인의 스페셜 에디션이 작가 사인 인쇄본과 명문장 노트의 세트 구성으로 독자들에게 선보인다. 마음의 목소리에 귀기울이는 것이 얼마나 중요한지 증언하는 성서와도 같은 책, 진정 자기 자신의 꿈과 대면하고자 하는 모든 이를 축복하는 희망과 환희의 메시지, 전 세계 8천 5백만 독자의 사랑을 받.."
9,10,미드나잇 라이브러리,매트 헤이그,"밤 12시, 죽기 바로 전에만 열리는 마법의 도서관에서인생의 두 번째 기회를 드립니다★★★★★국내 주요 서점 종합 베스트셀러 1위, 2021년 올해의 책 선정★★★★★《뉴욕타임스》 베스트셀러 1위, 영국 아마존 종합 베스트셀러 1위매트 헤이그의 소설 《미드나잇 라이브러리》는 2021년 4월 출간 이후 10개월 만에 30만 독자의 마음을 사로잡으며 눈물과 웃음, 가슴 뭉클한 감동을 선사하고 있다. 죽기로 결심한 주인공 ‘노라 시드’가 삶과 죽음 사이에 존재하는 미스터리한 도서관 ‘미드나잇 라이브러리’에서 눈을 뜨며 인생의 두 번째 기회를 얻는 이 소설은, 노라의 가장 완벽한 삶을 찾는 모험을 따라가며 ‘살아 있음’과 ‘살아가는 것’에 대한 깊은 통찰을 보여준다.“책을 덮는 순간 내일이 기대된다!” “내 인생의.."
10,11,마녀식당으로 오세요,구상희,"▶ 메인 포스터 띠지, 스페셜 포스터 띠지 중 랜덤으로 제공됩니다.“어떤 소원을 주문하시겠어요?”송지효 남지현 채종협 주연, 티빙 오리지널 드라마 원작 소설제3회 교보문고 스토리공모전에서 대상을 수상하며 ‘한국형 현실 판타지’의 등장을 알린 장편소설 『마녀식당으로 오세요』가 개정판으로 출간됐다. 인생의 막다른 골목길에 다다른 이들이 소원을 이루어주는 요리를 파는 ‘마녀식당’을 만나 삶을 다시 꾸려나갈 동력을 얻는다는 이야기로, 티빙 오리지널 드라마로 제작되어 방영을 앞두고 있다. 작가의 첫 작품이라는 것이 믿기지 않을 정도로 탄탄한 구성과 빠른 속도감, 눅진하게 남는 결말의 여운이 일품인 이 소설은 장르의 문법을 현실에 자연스럽게 녹여내며 독자들의 뜨거운 호응을 받았다. 믿었던 사랑에게 배신당하고, 끈질긴 .."
11,12,순례 주택,유은실,"한국어린이도서상, IBBY 어너리스트 수상작가 유은실의 신작 청소년 소설『순례 주택』. 코믹 발랄한 캐릭터 설정과, 순례 주택을 둘러싼 한바탕 대소동은 기발하면서도 유쾌하다. 약간은 막 가는 수림이네 네 식구가 쫄딱 망한 뒤, 돌아가신 외할버지의 옛 여자친구의 빌라‘순례 주택’으로 이사 들어가면서 벌어지는 이야기이다. 솔직하지 못한 엄마, 누군가에게 얹혀사는 데 일가견 있는 아빠, 라면은 끓일 줄 모르고 컵라면에 물만 겨우 부을 줄 아는 고등학생 언니까지, 졸지에 망한 수림이네 가족은 평소 업신여기던 순례 주택으로 이사 오게 된다. “온실 밖으로 나와 세상에 적응하게끔” 훈련시켜 주려는 순례 씨의 원대한 계획이 시작된 것이다. 자기 힘으로 살아 보려고 애쓰는 순례 주택에 세 들어 사는 사람들 사이에서 수림이.."
12,13,주머니 속의 고래,이금이,"청소년 문학의 독보적 장르,이금이 작가의 〈주머니 속의 고래〉 개정판때론 방황해도 끝내는 반짝반짝 빛날 10대들의 마음을 섬세하게 다독인다!이 시대 최고의 어린이청소년문학가로 꼽히는 이금이 작가의 청소년소설 『주머니 속의 고래』 개정판이 출간되었다. 이금이 작가는 2004년에 첫 청소년소설 『유진과 유진』을 펴내면서 한국 청소년문학의 본격 시작을 알렸고, 이후 청소년들의 생생한 현실을 소재로 꾸준히 작품을 발표하면서 어린이 청소년 어른 독자 모두에게 사랑받는 작가로 자리매김했다.이번에 개정판으로 출간되는 『주머니 속의 고래』는 청소년들의 ‘꿈’에 관한 이야기다. 네 명의 16세 중학생을 중심으로 펼쳐지는 이 시대 아이들의 현실적인 고민을 생생하게 담아내어, 초판 출간 이후 중학교 교과서에 수록되어 지금까지 .."
13,14,두 번째 엔딩,"김려령, 배미주, 이현, 김중미, 손원평, 구병모, 이희영, 백온유","우리를 웃고 울게 했던 작품, 모두가 기다려 온 그 뒷이야기!빛나는 성장의 순간에 언제나 함께한 이름, 창비청소년문학 100권 기념 소설집『우아한 거짓말』부터 『아몬드』 『페인트』 『유원』까지, 독자들의 큰 사랑을 받은 작품들의 뒷이야기를 엮은 소설집 『두 번째 엔딩』이 창비청소년문학 100권으로 출간되었다. 시리즈 100권을 맞이해 그동안 받은 사랑에 보답하는 풍성한 기획이다. 창비청소년문학상 1회 수상자인 김려령 작가부터, 배미주 이현 김중미 손원평 구병모 이희영 백온유 등 시리즈를 대표하는 베스트셀러 작가들의 완성도 높은 단편이 실렸다. 이번 소설집은 전작에서 주인공이 아니었던 인물들의 속내까지 따스하게 보듬으며 모든 삶이 조명받아 마땅한 가치가 있다는 메시지를 전한다.동생을 잃은 언니의 아픈 마음을 .."
14,15,보통의 노을,이희영,"『페인트』 작가 이희영 신작18세 애늙은이 아들, 34세 철없는 엄마그들 사이에는 말하지 않는 진실이 있다!가족의 의미를 새롭게 살펴본 장편소설 『페인트』로 창비청소년문학상을 수상한 이희영 작가. 그가 이번에는 ‘보통의 의미’를 묻는 작품으로 돌아왔다. 『보통의 노을』은 평범한 삶을 꿈꾸지만 예기치 못한 일을 마주하고 흔들리는 열여덟 최노을의 이야기다. 노을은 작은 공방을 운영하는 엄마와 단둘이 살고 있다. 열일곱 살에 노을을 낳은 엄마는 가뜩이나 젊은 나이에 동안이기까지 하다. 그런 엄마를 5년 동안 바라봐 온 연하의 남자가 있는데 절친 성하의 오빠 성빈이다. 엄마는 처음에는 성빈을 완강히 밀어내지만 계속된 그의 기다림에 조금씩 마음을 연다.노을은 성빈이 미덥지 않다. 엄마가 사회생활을 막 시작한 어린 남.."
15,16,남매의 탄생,안세화,"전국의 중고등학생 청소년 100명이 직접 뽑은 문학상제1회 틴 스토리킹 수상작현대 사회의 논쟁적인 소재를 SF 소설 형식으로 담은 『기억 전달자』, 핵전쟁 이후의 지구를 그린 SF 스릴러 『최후의 Z』, 미래 사회의 인간복제를 그린 『파랑 피』, 실제 역사를 바탕으로 감동적인 우정을 그린 『줄무늬 파자마를 입은 소년』, 근미래의 디스토피아를 그린 『밀레니얼 칠드런』 등 국내외 다양한 작품을 소개하며 청소년 문학의 지평을 넓혀 온 비룡소가 청소년 문학에 또 한 번 새로운 바람을 일으키고자, 십 대 독자와 더 깊고 즐거운 호흡을 위해 새롭게 제정한 청소년 소설 문학상, 제1회 틴 스토리킹 수상작 『남매의 탄생』이 비룡소에서 출간되었다. 틴 스토리킹은 국내 최초로 어린이 심사위원 제도를 도입한 어린이 문학상 ‘스.."
16,17,조제와 호랑이와 물고기들,다나베 세이코,"아쿠타가와상 수상 작가 다나베 세이코 대표작빛나는 감각으로 그려낸 사랑과 연애의 본질‘내 인생 잊지 못할 사랑 영화 1위’이누도 잇신 감독 〈조제, 호랑이 그리고 물고기들〉 원작한국판 리메이크▶ 한지민·남주혁 주연, 김종관 감독 영화 〈조제〉 원작2020 부산국제영화제 폐막작▶ 일본 애니메이션 〈조제, 호랑이 그리고 물고기들〉 원작싸한 사랑의 기억, 이 시대 최고의 연애소설『조제와 호랑이와 물고기들』은 일본의 국민작가로 존경받는 아쿠타가와상 수상 작가 다나베 세이코가 ‘연애’를 테마로 쓴 단편소설집이다. 작가 다나베 세이코는 1963년 『감상여행』으로 아쿠타가와상을 수상하고 2000년 국가 문화공로자로 선정되기까지 소설과 에세이, 평전 등 240여 편에 달하는 작품을 펴냈으며, 특히 일본 2백만 부 베스트셀.."
17,18,세계를 건너 너에게 갈게,이꽃님,"*드라마 및 영화 제작 중*일본, 대만, 태국 판권 수출*2019 양주시 올해의 책 | 2019 안동시 올해의 책 | 2020 천안 올해의 책“어쩌면 우린 너무 많은 기적을 당연하게 여기면서 사는지도 모르겠어.”이꽃님 작가의 장편소설 『세계를 건너 너에게 갈게』 양장본 출간제8회 문학동네청소년문학상 대상을 받은 이꽃님 작가의 장편소설 『세계를 건너 너에게 갈게』가 양장본으로 출간됐다. ‘은유’라는 똑같은 이름을 가진 두 사람이 시공간을 초월해 편지를 주고받으며 펼쳐지는 이 이야기는 드라마와 영화로 제작 중이며, 현재 일본, 대만, 태국에 판권이 수출되었다. 얼굴이 부을 만큼 울었다, 수도꼭지처럼 눈물이 터졌다, 손수건을 준비할 것… 등 ‘눈물’이 언급되는 평이 압도적으로 많은 이 책은 청소년을 넘어 초등학생.."
18,19,유진과 유진,이금이,"여전히 “네 잘못이 아니야”가 중요한 이유ㅡ 출간 후 16년, 한국 청소년문학의 출발점이자 대표작으로서여전히 ‘상처를 모아 지은 날개’마저 꺾이곤 하는 청소년들에게새 얼굴, 달라진 시대감각으로 건네는 변함없는 공감과 위로지난 16년간 수십만 독자와 울고 웃으며 한국 청소년문학의 견인차 구실을 해온 『유진과 유진』의 개정판이 나왔다. 『유진과 유진』은 국내 청소년문학 태동기라 할 2004년에 본격적인 청소년소설을 표방하며 출간된 이금이 작가의 장편소설이다. 우리 청소년의 ‘지금 여기’를 그들의 시선과 목소리로 담아낸 소설로도 첫발에 해당하는 이 작품은 청소년뿐 아니라 어린이와 어른까지 전 세대의 사랑을 꾸준히 받으며 ‘레전드 스테디셀러’로 자리매김했다.『유진과 유진』은 이 시대 최고의 어린이청소년문학가로 꼽히.."
19,20,행운이 너에게 다가오는중,이꽃님,"제8회 문학동네청소년문학상 대상 수상작 『세계를 건너 너에게 갈게』의 이꽃님 작가가 그리는 또 하나의 기적내가 너의 행운이 될 수 있을까?인생을 지독하게 만드는 것은 인간이지만, 그 인생에 손을 내미는 것 또한 언제나 인간이니까. 베스트셀러 『세계를 건너 너에게 갈게』의 이꽃님 작가가 2년 반 만에 새 청소년소설로 돌아왔다. 제8회 문학동네청소년문학상 대상을 받은 『세계를 건너 너에게 갈게』는 심사위원을 비롯해 수많은 독자들을 울렸으며, 지금도 많은 청소년들에게 ‘인생 책’으로 꼽히며 입소문을 더해 가고 있다. 대만에서 출간된 데 이어 최근에는 일본 출간이 확정되고 드라마와 영화로도 준비 중인 흡입력 있는 이야기이다.신작 『행운이 너에게 다가오는 중』은 가장 따뜻해야 할 집이라는 공간에서 폭력을 맞닥뜨릴 수.."
20,21,죽은 이들의 뼈 위로 쟁기를 끌어라,올가 토카르추크,"2018년 노벨 문학상 수상 작가인 올가 토카르추크가 《방랑자들》을 발표한 지 일 년 만에 내놓은 범죄 스릴러 『죽은 이들의 뼈 위로 쟁기를 끌어라』가 민음사에서 출간되었다. 일명 ‘별자리 소설’로서 곱씹어 읽어야 비로소 촘촘히 배치된 연결 고리가 보이는 《방랑자들》과는 달리, 이 작품은 처음부터 끝까지 긴장감을 유지하며 단숨에 읽힌다."
21,22,보건교사 안은영,정세랑,본격 학원 명랑 미스터리 소설출간 5주년 & 영상화 기념 리커버 특별판 출간!2015년 12월에 출간되어 꾸준한 사랑을 받아 온 『보건교사 안은영』이 출간 5주년과 작품 영상화를 기념하여 ‘리커버 특별판’으로 출간되었다. 2010년 단편소설에서 탄생한 ‘안은영’이 ‘넷플릭스 오리지널 시리즈’의 히어로가 되기까지의 소회가 담긴 작가의 편지로부터 책은 시작한다. 그 시간 동안 안은영이 자신에게 좋은 친구가 되어 주었다는 정세랑의 고백은 아마 많은 독자에게도 마찬가지일 것이다. 그 친구가 오랜만에 새 옷을 입었다. 일러스트레이터 ‘람한’의 작업으로 새로 탄생한 표지 디자인은 소설의 세계관을 충실히 반영하는 동시에 유니크한 색감과 구성으로 독자들의 소장 욕구를 자극한다. 또한 책의 뒤편에 자리한 다섯 편의 추천사는..
22,23,진짜 진짜 얼굴을 찾아서,조용,"〈사이코지만 괜찮아〉 속 동화들을 책으로 만나다!서로 다른 세 사람이 만나 상처를 보듬고 치유해 가는 조금은 이상한 로맨틱 코미디 〈사이코지만 괜찮아〉. 드라마 속 사랑을 모르는 유명 동화 작가 문영이 쓴 동화들을 책으로 만나는 ‘사이코지만 괜찮아 특별 동화’ 시리즈가 위즈덤하우스에서 출간된다. 대본을 맡은 조용 작가와 일러스트를 그린 잠산 작가가 직접 참여하여 여운과 감동을 그대로 담아냈으며, 극 중 문영의 친필 사인 인쇄본으로 소장 가치를 더한다."
23,24,살인자의 기억법,김영하,"김영하 등단 25주년을 맞이해 새롭게 선보이는 '복복서가 김영하 소설'의 네번째 작품으로 <살인자의 기억법>을 출간한다. 김영하의 일곱번째 장편소설인 <살인자의 기억법>은 2013년 문학동네에서 초판이 출간된 이래로 지금까지 56쇄를 중쇄하며 많은 사랑을 받아왔으며, 2020년 독일에서 '최고의 추리소설' 1위에 선정되기도 하는 등 많은 나라에서 호평을 받고 있다. 알츠하이머에 걸려 희미해지는 기억과 사투를 벌이는 연쇄살인범 김병수는 기억을 붙잡기 위해 자신의 일거수일투족을 녹음하고, 매일의 일과를 일기로 기록한다. 소설은 이 주인공이 일지 형식으로 쓰는 짧은 글들의 연쇄로 이루어진다. 패러독스와 위트가 넘치는 문장들 속에 감추어진 진의를 찾아가는 독서 경험은 한 편 한 편의 시를 읽는.."
24,25,사랑 광기 그리고 죽음의 이야기,오라시오 키로가,"〈셰이프 오브 워터〉 영화감독 기예르모 델 토로가 사랑하는 작가!라틴아메리카 환상문학의 선구자 오라시오 키로가의 대표작근대 단편소설의 거장이자 라틴아메리카 환상문학의 선구자로 손꼽히는 오라시오 키로가의 대표작 『사랑 광기 그리고 죽음의 이야기』가 문학동네 세계문학전집 190번으로 출간된다. 문학동네 세계문학전집에서 처음으로 소개되는 우루과이 작가다. 중남미 환상문학의 기틀을 마련한 작품이라 평가받는 「깃털 베개」와 「목 잘린 닭」을 비롯해 총 열여덟 편의 작품이 담겨 있으며, 앞의 두 작품과 「멘수들」을 뺀 나머지 열다섯 편은 국내에 최초로 선보이는 작품들이다. 1917년 출간된 이 소설집은 ‘사랑’ ‘광기’ ‘죽음’이라는 세 가지 주제를 통해 삶의 불분명한 표면 아래 숨어 있는 진실, 재현 불가능한 미지의.."
25,26,"손, 아귀",조용,"〈사이코지만 괜찮아〉 속 동화들을 책으로 만나다!서로 다른 세 사람이 만나 상처를 보듬고 치유해 가는 조금은 이상한 로맨틱 코미디 〈사이코지만 괜찮아〉. 드라마 속 사랑을 모르는 유명 동화 작가 문영이 쓴 동화들을 책으로 만나는 ‘사이코지만 괜찮아 특별 동화’ 시리즈가 위즈덤하우스에서 출간된다. 대본을 맡은 조용 작가와 일러스트를 그린 잠산 작가가 직접 참여하여 여운과 감동을 그대로 담아냈으며, 극 중 문영의 친필 사인 인쇄본으로 소장 가치를 더한다."
