,순위,책이름,저자,줄거리
52,53,플립,웬들린 밴 드라닌,"영화 [플립] 원작 소설. 두 주인공이 7살부터 13살까지 성장기를 보내며 겪는 이야기들을 다룬 작품이다. 괴짜 소녀 줄리와 외모만 번듯한 소심 소년 브라이스, 이 두 주인공이 마치 일기를 쓰듯 각자의 속마음을 번갈아 서술하는 1인칭 시점으로 이야기가 진행된다. 나무 타기를 즐기는 만능 우등생 소녀 줄리는 앞집에 이사 온 푸른 눈동자의 브라이스에게 첫눈에 반하고 적극적으로 자신의 마음을 전한다. 하지만 출중한 외모 말고는 내세울 것 없는 소심남 브라이스는 줄리를 일생일대의 위협으로 여겨 밀어내기에 급급하다. 그렇게 브라이스는 자그마치 6년 동안 줄리를 피하고 도망 다닌다. 그러던 어느 날, 줄리가 선물한 달걀을 내다 버리던 브라이스의 만행이 발각되면서 둘의 관계는 역전된다. 줄리는 세상에서 가장 멋진 푸른 .."
53,54,도가니,공지영,"2009년 출간된 이래 큰 파장을 일으키며 사회적 약자와 소수자에 대한 폭력 문제를 본격적으로 공론화했던 장편소설 『도가니』가 2017년 100쇄를 기념하여 새로운 장정으로 출간되었다. 이 소설은 출간 전 인터넷 연재 시 조회수 1,100만을 넘을 만큼 독자들의 큰 사랑을 받았고 지금까지 83만부라는 판매고를 올리며 출간 후 8년이 지난 현재까지도 독자들에게 꾸준히 사랑받고 있다. 소설 『도가니』는 2011년 개봉한 동명의 영화로 재조명되며 큰 사회적 이슈를 불러일으켰다. 그후 2011년 10월 일명 ‘도가니법’(‘성폭력 범죄의 처벌 등에 관한 특례법 개정안’) 국회통과를 이끌어내며 우리 사회에 다시금 경종을 울린 『도가니』는 예리한 통찰력과 속도감 있는 문장으로 현실의 부조리를 파헤쳐온 작가 공지영의 명실.."
54,55,옥수수 뺑소니,박상기,"다시 한 번 책과 가까워지고 문학을 좋아하게 될 기회를 전하다!문학적으로 뛰어난 단편소설에 풍성한 일러스트를 더한 새로운 소설 읽기 시리즈 「소설의 첫 만남」 제4권 『옥수수 뺑소니』. 흥미로운 이야기와 100면 이내의 짧은 분량, 매력적인 삽화를 통해 책 읽기를 낯설어하는 독자들도 동시대의 좋은 작품에 부담 없이 접근할 수 있도록 구성한 이번 시리즈는 문학과 점점 멀어진 이들이 다시 책과 가까워질 수 있게끔 돕는 마중물 역할을 하면서 우리의 독서 문화에 신선한 활력을 불어넣고자 한다.박상기 작가의 청소년소설 『옥수수 뺑소니』. 제5회 창비어린이 신인문학상을 수상한 소설로서 빼어난 완성도가 돋보이는 작품이다. 두 번의 교통사고를 연달아 당한 뒤 상황에 떠밀려서 거짓말을 하게 된 주인공 현성이의 이야기가 담겼.."
55,56,남한산성,김훈,"그해 겨울, 성 안에서는 무슨 일이 벌어졌나김훈 특유의 냉혹하고 뜨거운 말로 치욕스런 역사의 한 장면을 보여주는 소설 『남한산성』. 2007년 펴낸 초판 이후 저자가 십 년의 세월을 지나 비로소 털어놓는 ‘못다 한 말’을 담고, 화가 문봉선의 그림을 수록하고, 새 옷을 갈아입은 개정판으로 만나본다. 병자호란 당시, 길이 끊겨 남한산성에 갇힌 무기력한 인조 앞에서 벌어진 주전파와 주화파의 다툼, 그리고 꺼져가는 조국의 운명 앞에서 고통 받는 민초들의 삶이 소설의 씨줄과 날줄을 이루어, 치욕스런 역사를 보여준다.1636년 병자년 겨울. 청의 대군은 압록강을 건너 서울로 진격해 오고, 조선 조정은 길이 끊겨 남한산성으로 들 수밖에 없었다. 소설은 1636년 12월 14일부터 1637년 1월 30일까지 47일 동안.."
56,57,삼생삼세 십리도화,당칠공자,"세 번의 삶, 그리고 단 하나의 사랑!2017년 58부작으로 제작되어 중국 현지에서 경이로운 인기를 이어가고 있는 중국 드라마 《삼생삼세 십리도화》의 원작 소설 『삼생삼세 십리도화』. 중국의 고유한 세계관에서 영감을 얻어 탁월한 상상력과 섬세하고 우아한 필치로 자신만의 작품 세계를 구축한, 저력 있는 신예 작가 당칠공자의 「삼생삼세 시리즈」가운데 첫 작품이다. 중국 고서 《산해경》에서 소재를 빌려왔고, 불교의 인과 사상과 환생, 도교의 신선 개념이 혼합된 독특한 세계관을 기본으로 하며 중국 고대 전설과 신화까지 녹아 있는 작품이다.수많은 신들이 쇠락하고 몇몇 신족만이 평화롭게 사는 가운데, 오만 살의 철부지 신선 백천은 수련을 위해 남장을 하고 ‘사음’이라는 이름으로 전쟁의 신 묵연의 제자로 들어간다. 사음.."
57,58,너의 췌장을 먹고 싶어,스미노 요루,"잔혹한 비밀을 가진 소녀와 임시 친구 계약을 맺은 소년의 이야기!2016년 일본 서점 대상 2위에 오른 스미노 요루의 첫 소설이다. 시한부 선고를 받은 소녀와 함께한 어느 소년의 이야기를 그리고 있다. ‘요루노 야스미’라는 필명으로 소설 투고 웹사이트 〈소설가가 되자〉에 원고를 올리기 시작한 것이 이 작품의 시작이었다.처음에는 파격적인 타이틀로 눈길을 끌었지만 결말이 정해진 이야기임에도 불구, 섬세한 문체와 이야기를 끌고 가는 작가의 필력이 대단하고 무엇보다 재미있다는 평가를 받으며 입소문을 타기 시작했다. 이후 출판사 편집자의 눈에 띄어 책으로 출간되었고, 작가는 어마어마한 주목을 받으며 일본 문단에 등장하게 되었다.자의적인 은둔형 외톨이 남학생 ‘나’는 우연히 초긍정 인기 만점 동급생인 사쿠라의 〈공병문.."
58,59,너의 췌장을 먹고 싶어,스미노 요루,"잔혹한 비밀을 가진 소녀와 임시 친구 계약을 맺은 소년의 이야기!2016년 일본 서점 대상 2위에 오른 스미노 요루의 첫 소설이다. 시한부 선고를 받은 소녀와 함께한 어느 소년의 이야기를 그리고 있다. ‘요루노 야스미’라는 필명으로 소설 투고 웹사이트 〈소설가가 되자〉에 원고를 올리기 시작한 것이 이 작품의 시작이었다. 처음에는 파격적인 타이틀로 눈길을 끌었지만 결말이 정해진 이야기임에도 불구, 섬세한 문체와 이야기를 끌고 가는 작가의 필력이 대단하고 무엇보다 재미있다는 평가를 받으며 입소문을 타기 시작했다. 이후 출판사 편집자의 눈에 띄어 책으로 출간되었고, 작가는 어마어마한 주목을 받으며 일본 문단에 등장하게 되었다.자의적인 은둔형 외톨이 남학생 ‘나’는 우연히 초긍정 인기 만점 동급생인 사쿠라의 〈공병.."
59,60,도깨비 2,"김은숙, 김수연","“너와 함께한 모든 시간들이 눈부셨다. 날이 좋아서, 날이 좋지 않아서, 날이 적당해서, 모든 날이 좋았다.""김은숙 작가 특유의 감각적인 대사와 생생한 캐릭터 묘사에 섬세한 감정의 결이 더해진 소설 『도깨비』 제2권. 도깨비의 탄생부터 그 탄생의 배경, 이와 관련된 전생과 현생, 도깨비 신부, 저승사자 등 여러 인물들의 인연과 운명, 삶과 죽음, 선택이라는 삶에 대한 다양한 이야기들을 전하며 매회 화제를 불러일으킨 TVN 드라마 《도깨비》의 원작소설이다. 드라마 이면에 자리한 등장인물들의 숨은 이야기를 통해 읽는 즐거움과 드라마와는 또 다른 감동을 선사한다.자신이 지키던 주군의 칼날에 죽었으나 상인지 벌인지 모를 신의 계시로 심장에 검이 꽂힌 채 불멸을 살아가게 된 남자 김신. 도깨비 신부만이 검을 뽑을 수.."
60,61,동급생,프레드 울만,"프레드 울만의 작은 걸작 『동급생』 드디어 출간나치즘과 홀로코스트의 시대를 다룬 소설 중에서 가장 유명하고 지금까지 널리 읽히는 책의 하나인 『동급생』이 열린책들에서 출간되었다. 『동급생』은 1930년대 독일 슈투트가르트를 배경으로 유대인 소년과 독일 귀족 소년의 우정을 그린 프레드 울만의 소설이다. 작가 아서 케스틀러가 [작은 걸작]이라 평가하며 찬사를 아끼지 않았고, 아카데미 프랑세즈 회원이자 『르 피가로』 주필이었던 장 도르메송이 [눈물을 펑펑 쏟으며 울었다]고 고백한 바 있다.이 작품은 사춘기 두 소년이 우정을 형성해 가는 과정을 생동감 있게 묘사했다. 독일 서남부 지역의 아름다운 풍경 속에서 펼쳐지는 두 소년의 우정 이야기는 히틀러와 나치즘이 대두하는 시대.."
61,62,도깨비 1,"김은숙, 김수연","“너와 함께한 모든 시간들이 눈부셨다. 날이 좋아서, 날이 좋지 않아서, 날이 적당해서, 모든 날이 좋았다.”김은숙 작가 특유의 감각적인 대사와 생생한 캐릭터 묘사에 섬세한 감정의 결이 더해진 소설 『도깨비』 제1권. 도깨비의 탄생부터 그 탄생의 배경, 이와 관련된 전생과 현생, 도깨비 신부, 저승사자 등 여러 인물들의 인연과 운명, 삶과 죽음, 선택이라는 삶에 대한 다양한 이야기들을 전하며 매회 화제를 불러일으킨 TVN 드라마 《도깨비》의 원작소설이다. 드라마 이면에 자리한 등장인물들의 숨은 이야기를 통해 읽는 즐거움과 드라마와는 또 다른 감동을 선사한다.자신이 지키던 주군의 칼날에 죽었으나 상인지 벌인지 모를 신의 계시로 심장에 검이 꽂힌 채 불멸을 살아가게 된 남자 김신. 도깨비 신부만이 검을 뽑을 수.."
62,63,시그널 1,김은희,"간절함이 보내온 신호, 드라마를 그대로 옮겨 놓은 대본집!한국형 범죄 수사 드라마의 신기원을 이룬 《시그널》 대본집 제1권. 오래된 무전기 하나로 30년의 시간을 넘나들며 미제 사건을 해결해 나가는 스릴러 장르의 드라마이다. 드라마 시그널의 대사들은 우리의 일상을 절절히 반영해 내었다. 대본집에 담긴 주옥같은 대사들을 통해 다시 한 번 드라마의 진한 감동을 되살려 본다. 드라마를 보면서 궁금했던 점을 다시금 되뇌여 그 참뜻을 이해하고 나면 더욱 큰 재미와 감동을 느낄 수 있다. 드라마를 접하지 않은 이들은 밀도 높은 스토리에 빠져 들게 되고, 드라마를 사랑한 이들에게는 가슴속에 오래 간직할 수 있는 또 다른 여운을 선사할 것이다."
63,64,시그널 2,김은희,"간절함이 보내온 신호, 드라마를 그대로 옮겨 놓은 대본집!한국형 범죄 수사 드라마의 신기원을 이룬 《시그널》 대본집 제2권. 오래된 무전기 하나로 30년의 시간을 넘나들며 미제 사건을 해결해 나가는 스릴러 장르의 드라마이다. 드라마 시그널의 대사들은 우리의 일상을 절절히 반영해 내었다. 대본집에 담긴 주옥같은 대사들을 통해 다시 한 번 드라마의 진한 감동을 되살려 본다. 드라마를 보면서 궁금했던 점을 다시금 되뇌여 그 참뜻을 이해하고 나면 더욱 큰 재미와 감동을 느낄 수 있다. 드라마를 접하지 않은 이들은 밀도 높은 스토리에 빠져 들게 되고, 드라마를 사랑한 이들에게는 가슴속에 오래 간직할 수 있는 또 다른 여운을 선사할 것이다."
64,65,82년생 김지영,조남주,"공포, 피로, 당황, 놀람, 혼란, 좌절의 연속에 대한 한국 여자의 인생 현장 보고서!문학성과 다양성, 참신성을 기치로 한국문학의 미래를 이끌어 갈 신예들의 작품을 엄선한 「오늘의 젊은 작가」의 열세 번째 작품 『82년생 김지영』. 서민들의 일상 속 비극을 사실적이면서 공감대 높은 스토리로 표현하는 데 재능을 보이는 작가 조남주는 이번 작품에서 1982년생 '김지영 씨'의 기억을 바탕으로 한 고백을 한 축으로, 고백을 뒷받침하는 각종 통계자료와 기사들을 또 다른 축으로 삼아 30대를 살고 있는 한국 여성들의 보편적인 일상을 완벽하게 재현한다.슬하에 딸을 두고 있는 서른네 살 김지영 씨가 어느 날 갑자기 이상 증세를 보인다. 시댁 식구들이 모여 있는 자리에서 친정 엄마로 빙의해 속말을 뱉어 내고, 남편의 결혼.."
65,66,핵폭발 뒤 최후의 아이들,구드룬 파우제방,"핵은 언제나 절실한 화두이다. 핵 문제가 수시로 불거지는 한반도에 우리가 살고 있기 때문이 아니라, 그 어디든 이 지구상에서 핵이 사라지지 않는 한 절실한 화두일 수밖에 없기 때문이다. '미래의 주인'인 아이들에게는 더더욱 그렇다. 그 모든 것을 망각하고 사는 존재들이 바로 우리라는 것은 또 얼마나 두려운 사실인가. 구드룬 파우제방의 『핵 폭발 뒤 최후의 아이들』은 선전포고도, 경고도 없이 독일의 한 도시에서 피어 오른 섬광과 버섯구름으로 시작된다. 그 찰나의 순간에 많은 이들이 죽고 사라진다. 그러나 그들은 차라리 다행스럽다. 진정한 '최후'는 간신히 살아 남은 자들에게 천천히, 더욱 참혹하게 찾아온다. 구드룬 파우제방은 스스로 부른 재앙에 처참하게 스러져가는 인류의 모습을 단 한 점의 동정도 없이 냉정하.."
66,67,공원을 헤엄치는 붉은 물고기,곤살로 모우레,"인생이라는 공원에는 언제나 사랑과 기적이 있다!『공원을 헤엄치는 붉은 물고기』에는 알리시아 바렐라가 그린 12장의 그림과 곤살로 모우레가 선사하는 7편의 이야기가 담긴 어른들을 위한 그림책이다. 사랑싸움을 하는 젊은 커플의 이야기도 있고, 갑자기 세월의 허무함을 느낀 중년 여성의 이야기도 있고, 가난한 예술가의 이야기도 있다. 붉은 물고기가 헤엄치는 공원에서 사람들은 사랑하는 사람을 만나고 기적을 만난다.이 책은 잔잔하고 아름다운 그림으로 채워져 있다. 첫 장면에서 발견한 주인공에게 어떤 일이 일어나는지 다음 장면을 넘겨보자. 첫 장면부터 마지막 장면까지 주인공의 모습을 따라가다 보면 머릿속에 자신만의 이야기가 만들어진다. 글 없는 그림책을 보는 것은 마치 숨은 그림 찾기를 하는 것 같기도 하고, 플립북 애.."
67,68,보건교사 안은영,정세랑,"발랄하고 용감한 여전사이자 동시에 다정하고 유쾌한 언니, 안은영!문학성과 다양성, 참신성을 기치로 한국문학의 미래를 이끌어 갈 신예들의 작품을 엄선한 「오늘의 젊은 작가」의 아홉 번째 작품 『보건교사 안은영』. 참신한 상상력과 따뜻한 이야기로 독자의 사랑을 받아 온 소설가 정세랑의 이번 작품은 수동적이지 않고 주체적이며, 감상적이지 않고 감각적인, 아는 형 삼고 싶은 사립 M고의 보건교사 안은영의 이야기를 담고 있다.특별한 것 없는 직업과 평범한 이름의 안은영은 보통의 보건교사가 아니다. 복 중의 복, 일복 하나는 타고난 그녀는 직업으로 ‘보건교사’ 역할에 충실하면서 동시에 자신만이 볼 수 있는 것들을 처치하고 쫓아내며, 또는 위로하는 ‘퇴마사’의 운명을 받아들인다. 여기에 사립 M고의 한문교사이자 학교 설.."
68,69,오베라는 남자,프레드릭 배크만,"웬만하면 마주치고 싶지 않은 까칠한 이웃 남자, 오베가 나타났다!무엇이든 발길질을 하며 상태를 확인하는 남자. BMW 운전자와는 말도 섞지 않는 남자. 키보드 없는 아이패드에 분노하는 남자. 매일 아침 6시 15분 전 알람도 없이 깨어나 항상 같은 시간, 같은 양의 커피를 내려 아내와 한 잔씩 나누어 마시고 마을 한 바퀴를 돌며 시설물들이 고장 난 것은 없는지, 아니 누군가 고장 낸 것은 없는지 확인하는 남자, 오베. 그런 그의 인생에 균열이 생기기 시작했다.시작은 이렇다. 한 세기의 3분의 1을 한 직장에서 일한 그는 하루아침에 일생을 바친 직장에서 쫓겨나고 만다. 이렇게 된 상황에 반년 전 떠난 아내의 빈자리가 유난히 크게 느껴진다. 늘 같은 일상을 반복해왔던 그이지만 이제는 책임져야 할 사람도, 일자리.."
69,70,그림 형제 동화전집,그림 형제,"『그림 형제 동화전집(완역본)』에는 그림 형제의 작품 210편이 담겨 있다. 《개구리 왕자》 《백설공주》《라푼첼》《헨젤과 그레텔》 등 누구나 한 번쯤 들어봤을 만한 익숙한 동화의 제목이자 오늘날에는 애니메이션, 영화 등의 형태로 끊임없이 재해석되는 이야기들의 공통점은 그림 형제가 약 200년 전 수집했던 이야기들이 원작이라는 점이다. 유럽 지역에 전해 내려오던 이야기 속에서 인간적인 심성의 기원이 무엇인지 밝히고자 노력했던 그림 형제. 그들의 노력으로 시간이 지금까지 많은 사랑을 받고 있는 이야기를 통해 인간 본성의 여러 가지 모습과 색다른 재미를 느낄 수 있다."
70,71,연금술사,파울로 코엘료,"파울로 코엘료의 장편소설 <연금술사>의 일러스트레이션판. 삽화를 담당한 뫼비우스는 <연금술사>의 표지 그림을 그렸던 일러스트레이터이다. 소설의 주요 장면들을 솜씨 좋게 포착한 컬러 삽화가, 각각 독립된 페이지에 실려 있다.<연금술사>는 세상을 두루 여행하기 위해 양치기가 된 청년 산티아고의 '자아의 신화' 찾기 여행담이다. '나르키소스'에 대한 오스카 와일드의 멋진 재해석으로 시작되는 이 소설은, 자칫 딱딱하게 보일 수 있는 제목과는 달리 간결하고 경쾌한 언어들로 쓰여 있어서 물이 흘러가듯 수월하게 읽히는 작품이다.자신이 진정으로 원하는 것이 무엇인지 아는 사람이 세상에 얼마나 될까? 또 안다고 해도, 그 꿈을 포기하지 않고 끝까지 밀고 나갈 수 있는 의지와 끈기를 지닌 사람.."
71,72,책 읽어주는 남자,베른하르트 슐링크,"파격적인 사랑 이야기에 담긴 시대사!케이트 윈슬렛 주연의 영화 《더 리더》의 원작 『책 읽어주는 남자』. 독일 현대 소설을 대표하는 작가 베른하르트 슐링크의 대표작으로, 독일어권 문학 최초로 뉴욕 타임스 베스트셀러 1위에 오르고 각종 문학상을 수상했다. 작가는 이 소설로 인한 문학적 공로를 인정받아 2001년 프랑스로부터 레지옹 도뇌르 훈장을 받았다. 열다섯 살 소년과 서른여섯 살 여인의 파격적인 사랑 이야기를 통해 역사와 인간의 죄의식, 사랑, 윤리에 관한 깊은 통찰을 전한다.길을 지나던 여인 한나의 도움을 받게 된 소년 미하엘. 서로에게 강한 끌림을 느낀 두 사람은 이후 비밀스러운 연인이 된다. 한나는 미하엘과 관계를 갖기 전 책을 읽어달라고 말하고, ‘책 읽어주기, 샤워, 사랑 행위, 그러고 나서 잠시.."
72,73,나미야 잡화점의 기적,히가시노 게이고,"기적과 감동을 추리한다!히가시노 게이고의 차기 대표작으로 손꼽힐 『나미야 잡화점의 기적』『나미야 잡화점의 기적』은 2012년 3월 일본에서 출간되어 큰 화제를 불러일으킨, 우리 시대를 대표하는 작가 히가시노 게이고의 작품이다. 작가가 그동안 일관되게 추구해온 인간 내면에 잠재한 선의에 대한 믿음이 작품 전반에 깔려 있는 이번 이야기에는 그동안 히가시노 게이고 하면 떠올랐던 살인 사건이나 명탐정 캐릭터는 전혀 등장하지 않는다. 그럼에도 불구하고 마치 퍼즐을 맞추어가는 듯한 치밀한 짜임새는 과연 히가시노 게이고의 작품답게 명불허전의 짜릿한 쾌감을 선사하며 감동을 자아내 작가의 고정 독자를 충분히 매료시킨다. “여러분이라면 어떤 고민을 상담하시겠습니.."
73,74,시간을 파는 상점 1,김선영,"시간의 흐름 속에 숨겨진 마법 같은 비밀!제1회 자음과모음 청소년문학상을 수상한 김선영의 작품 『시간을 파는 상점』. 심사위원들의 만장일치로 선정된 당선작으로, 흐르는 시간이라는 소재를 다루고 있다. 소방대원으로 더불어 사는 삶을 실천하다 일찍 세상을 떠난 아빠의 뜻을 이어받은 주인공 온조. 인터넷 카페에 ‘크로노스’라는 닉네임으로 ‘시간을 파는 상점’을 오픈해 손님들의 어려운 일을 대신 해주면서 자신의 시간을 판다. 범인으로 지목된 아이가 학교 옥상에서 떨어져 죽은 PMP3 도난 사건에 대한 의뢰, 할아버지와 맛있게 식사를 해달라는 엉뚱한 의뢰, 천국의 우편 배달부가 되어 달라는 의뢰 등 여러 가지 의뢰가 이어진다. 그러던 중 PMP3 분실 사건으로 죽음에 이를 뻔한 친구가 밝혀지고 온조와 친구들에게 예상.."
74,75,픽션들,호르헤 루이스 보르헤스,"현대 소설의 패러다임을 창조한 보르헤스의 미학 세계!아르헨티나 문학을 대표하는 작가 호르헤 루이스 보르헤스의 소설집 『픽션들』. 1941년에 발표한 '두 갈래로 갈라지는 오솔길들의 정원'과 1944년에 발표한 '기교들'에 수록된 17편의 단편을 모은 책이다. 미셸 푸코, 자크 데리다, 움베르트 에코 등 현대 지성사의 핵심적인 인물들에게 큰 영향을 끼친 보르헤스의 세계관과 미학을 드러낸 대표작이다. 또한 일생 동안 장편소설을 한 편도 남기지 않은 것으로 유명한 단편 전문 작가 보르헤스의 문학적 정수를 엿볼 수 있다. 허구를 주제로 한 단편들은 가상과 실재, 기억과 환상의 경계를 넘나들며 생경하고 낯선 풍경을 보여준다."
75,76,두근 두근 내 인생,김애란,"두근두근 이 여름, 가슴 벅찬 사랑이 시작된다!김애란의 첫 장편소설 『두근두근 내 인생』. <달려라, 아비>, <침이 고인다> 두 권의 소설집만으로 문단과 독자들에게 많은 사랑을 받는 작가이자 한국문단의 차세대 대표작가로 떠오른 김애란. 모두가 기다리던 그녀의 첫 장편소설이 출간되었다. 가장 어린 부모와 가장 늙은 자식의, 우리 모두의 가슴을 두근거리게 하는 청춘과 사랑에 대한 눈부신 이야기가 펼쳐진다. 벅찬 생의 한순간과 사랑에 대한 반짝이는 통찰이 돋보인다."
76,77,브리다,파울로 코엘료,"당신은 이번 생에서 무엇을 찾고 있나요?<연금술사>로 세계적인 베스트셀러 작가로 우뚝 선 작가 파울로 코엘료의 신작『브리다』. <연금술사> 직후에 집필한 운명과 사랑에 관한 가장 아름다운 이야기로, 운명을 찾아나선 스무 살 브리다가 사랑을 찾고 더 나아가 자아를 발견하면서 변모해가는 가슴 뭉클한 여정을 그렸다. 주인공 브리다는 자기 발견의 여정에서 한 현자를 만나 두려움을 극복하는 법을 배우고, 한 여인을 통해 세상 속에 숨어 있는 음악에 맞춰 춤추는 법을 배운다. 그 과정을 통해 작가는 삶의 의미를 생각하고, 성찰할 수 있도록 이끌어준다. ☞ 북소믈리에 한마디! 운명을 찾아 떠나는 스무 살 브리다의 눈부신 자아 발견의 여정에 작가 특유의 신비주의와 리얼리즘을 적절히 결합해 충만하고 영.."
77,78,나의 라임 오렌지나무,J. M. 데 바스콘셀로스,"전 세계인을 울리고 웃긴 다섯 살 소년 제제의 이야기!사랑스런 꼬마 악동 제제의 슬프고 아름다운 동화 『나의 라임오렌지나무』. 너무나 일찍 삶에 숨겨진 슬픔을 발견한 5살 꼬마 제제의 이야기를 그린 전 세계의 베스트셀러다. 한국에서 처음으로 《나의 라임오렌지나무》를 출간했던 '동녁'에서 작가와 정식으로 계약하고 기존의 오역된 부분을 바로잡아 새롭게 출간했다. 제제의 아름답고도 가슴 저미는 성장 이야기와 함께 제제에게 진실된 사랑과 우정을 가르쳐준 뽀르뚜가와의 장난스런 만남과 고통스런 이별까지 따라간다. 감성적인 삽화가 책의 감동을 더해주고 있다.이 책이 오랜 시간 사랑받을 수 있었던 이유는 고단한 우리의 삶과 닮아 있어 함께 슬퍼 할 수 있었고, 어린 주인공이 자아를 발견해 나가는 동안 독자들도 함께 성장할.."
