,순위,책이름,저자,줄거리
78,79,연애 소설 읽는 노인,루이스 세풀베다,"개발이라는 미명을 내세운 인간들에 의해 변해가는 아마존을 위한 서사시!루이스 세풀베다의 이름을 알린 대표작 『연애 소설 읽는 노인』. 중남미 포스트붐 세대의 선두 주자이자 1990년대 라틴아메리카 문학의 새로운 부흥을 이끈 기수 루이스 세풀베다의 환경 소설이다. 기존의 소설에서 찾기 힘든 환경이나 생태계 문제를 다룸에도 불구하고 그러한 테마가 얼마든지 픽션으로 형상화될 수 있고 문학 작품으로 성공할 수 있다는 가능성을 보여 주는 작가 루이스 세풀베다가 긴 여정 같은 자신의 생활을 통해 보고 들은 한 인간의 삶을 예민하고 감수성 넘치는 언어로 형상화한 작품이다.세계적인 환경 운동가이자 아마존의 수호자인 치코 멘데스에게 바쳐진 이 작품에서 치과 의사의 걸죽한 입담을 빌려 라틴 아메리카의 현실을 질타하는가 하면,.."
79,80,내 영혼이 따뜻했던 날들,포리스트 카터,"인디언의 세계를 어린 소년의 순수한 감각으로 묘사한 작품으로 전미 서점상 연합회가 설정한 제1회 에비상 수상작. 따뜻한 할아버지의 손으로 표현되는 소박하고 진실한 인디언의 삶과，위선과 탐욕으로 점철된 백인사회의 모습이 선명한 대비를 이루는 이 작품은, 첨단 문명의 시대 속에서 정작 중요한 것이 무엇인지를 잊고 살아가는 현대인들에게 경각심을 일깨워준다."
80,81,두사람,이보나 흐미엘레프스카,"세상에서 가장 가까운 어떤 두 사람의 이야기『두 사람』은 세상에서 가장 가까운 두 사람 사이에 깃든 의미를, 멋진 비유에 담아 아름답게 설명하는 그림책입니다. 그 안에는 세상의 수많은 '두 사람'들이 서로의 사이에 대해 탐구하고 이해하길 바라는 작가의 마음이 고스란히 담겨 있습니다. 서로 같은 곳을 바라보기도 하고 다른 곳을 바라보기도 하는 '두 사람'의 관계를 절묘하게 표현한 그림이 돋보입니다. [양장본] ☞ 이런 점이 좋습니다!이 책에는 짧은 글이지만 가슴을 울리는 글이 실려 있습니다. 오히려 그림을 통해 '두 사람'의 관계성을 곰곰이 생각해 볼 수 있습니다. 반쪽만 있는 남자와 여자의 옷, 모양과 색깔이 다른 열쇠와 자물쇠을 비롯해 나와 상대방, 그렇게 두 사람의 관계성을 깊이 있게 사유할 수 있는 그.."
81,82,모든 것이 산산이 부서지다,치누아 아체베,"2007년 부커 상 수상 작가, 치누아 아체베 대표작폭력적인 서구 세력에 맞서 부족의 문화와 풍습을 지키려는 한 남자의 숭고한 이야기. 아프리카 원주민들이 지켜 오던 생활과 문화가 서구 세력의 침입에 의해 서서히 몰락하는 과정을 생생하게 묘사한 이 작품은 아프리카 탈식민주의 문학의 고전이라 불린다.19세기 말 아프리카, 우무오피아 마을의 오콩코는 성격이 불같고 공격적이며 권위적인 사람이다. 아버지가 불명예스럽게 죽은 후 그는 부와 명예를 회복하기 위해 부지런히 일하며, 자신의 힘을 과시하기 위해 전쟁에도 앞장선다. 하지만 오콩코는 예기치 못한 실수를 계기로 마을에서 추방당하고, 칠 년이 지난 후에야 마을로 돌아오게 된다.그런데 그가 돌아왔을 때 마을은 백인 교회를 중심으로 유입된 서구 문명 때문에 혼란에 휩.."
82,83,허삼관 매혈기,위화,"설령 목숨을 파는 거라 해도 난 피를 팔아야 합니다!가족을 위해 피를 파는 한 남자의 고단한 삶을 특유의 풍자와 해학으로 그려낸 중국 작가, 위화 장편소설. 한평생 피를 팔아 가족을 위기에서 구해낸 속 깊은 아버지 허삼관을 주인공으로 한 소설로, 삶의 고단함과 슬픔을 능청스럽게 껴안는 익살과 해학 그리고 그 뒤에 자리한 인간에 대한 속 깊은 애정을 만날 수 있다. 성안의 생사공장에서 누에고치 대주는 일을 하는 노동자 허삼관. 그의 삼촌들이 사는 마을에서는 피를 안 팔아본 남자는 여자를 얻을 수 없다. 결혼의 조건으로 가장 중요한 것은 건강인데 피를 팔 수 있다는 것은 건강하다는 증거이기 때문이다. 그래서 허삼관은 그 마을 사람인 근룡이와 방씨를 따라 피를 팔러 성안의 병원으로 간다. 피를 팔러 가는 날은 아.."
83,84,이성과 감성,제인 오스틴,"셰익스피어에 이어 ‘지난 천 년간 최고의 문학가’로 꼽힌 제인 오스틴의 첫 번째 소설. 19세기 초 잉글랜드. 엘리너와 메리앤 대시우드 자매는 아버지가 세상을 뜨고 유산이 의붓오빠인 존에게 넘어가자 하루아침에 무일푼이 되어 어린 동생, 어머니와 함께 여태껏 살아왔던 서식스의 저택을 쫓겨나다시피 떠나게 된다. 그들이 새 거주지로 떠나기 전 엘리너는 올케 패니의 남동생 에드워드를 사랑하게 된다. 그러나 그녀가 자신의 감정을 표현하기도 전에 이를 못마땅하게 여긴 패니가 자기 남동생을 런던으로 돌려보낸다. 그곳에서 그는 자신에게 맞는 훌륭한 배필을 만나 결혼해야 한다. 대시우드 가족들은 새로 이사한 시골집에 적응해 나가고, 엘리너는 에드워드로 인한 괴로움을 감추고 가족의 경제를 책임지며 살아간.."
84,85,백년 동안의 고독,가브리엘 가르시아 마르케스,"라틴아메리카의 특수한 사회구조를 환상적으로 직조해낸 가브리엘 마르케스의 대표작!노벨문학상 수상작가 가브리엘 마르케스의 대표 장편소설 『백년 동안의 고독』. 1982년 노벨문학상 수상작으로, 중남미 문학의 특징인 '마술적 리얼리즘'의 원조격인 소설로 평가받는다. 마을에서 도시로 팽창하다가 신기루처럼 사라져간 마콘도를 무대로 한 집안의 백년에 걸친 역사와, 기이한 자녀를 에워싸고 일어나는 이야기를 엮은 작품이다. 라틴 아메리카의 복합적인 인종, 문화, 역사적 전통과 현실을 배경으로 하여, 라틴아메리카의 특수한 사회구조를 생생하게 그려냈다."
85,86,달콤 쌉싸름한 초콜릿,라우라 에스키벨,"멕시코의 소설가 라우라 에스키벨의 첫 번째 장편 소설. 22년동안 이어진 애절한 사랑 이야기를 1월부터 12월까지 볼 수 있는 요리책처럼 독특하게 구성한 장편 소설 <달콤 쌉싸름한 초콜릿>은 멕시코 요리 특유의 냄새와 맛을 통해 에로틱한 상상을 불러일으킨다. 티타는 '막내딸은 죽을 때까지 어머니를 돌봐야 한다.'는 가족의 전통 때문에 연인인 페드로와 결혼하지 못한다. 페드로는 티타와 한 집에 있기 위해 티타의 언니인 로사우라와 결혼하고, 티타와 페드로의 사랑은 더욱 애틋해진다. 요리 재료와 시간에 마법을 걸어 부엌을 은밀하고 신비로운 세계로 창조해낸 티타는 자유와 평등, 그리고 자신의 목소리와 자신만의 사랑을 요리와 함께 완성하는데……. 음식을 자신을 표현해내는 수단으로 삼고 있는 티타의 사랑에 .."
86,87,네루다의 우편배달부,안토니오 스카르메타,"노벨문학상 수상작가인 파블로 네루다와 작은 어촌 마을의 우편배달부가 이어간 우정을 그린 영화,「일 포스티노」의 원작소설. 사랑에 빠진 우편배달부에게 시를 가르쳐주어 끝내 그 사랑을 이루게 한 시인의 모습이 인상적이다. 새로운 삶과 사랑을 이끌어내는 '문학의 힘'을 노래한 소설이자, 위대한 시인 네루다에게 바치는 헌사. 더불어 칠레의 민주화를 염원한 투쟁의 이야기이기도 하다. 때는 1970년대 초반. 칠레의 작은 어촌 마을에서 우편 배달부로 일하는 마리오는 마을의 가장 고명한 주민인 파블로 네루다에게 우편물을 전달하는 것이 유일한 업무이다. 아름다운 소녀 베아트리스를 보고 첫눈에 사랑에 빠진 마리오는 네루다에게 소녀를 위한 시를 써달라고 조른다. 네루다는 우체부에게 메타포를 가르쳐주어 베.."
87,88,죽은 시인의 사회,N.H.클라인바움,"◐ 획일화되고 출세만을 고집하는 교육의 말로를 분명히 보여주는 소설졸업생 70% 이상이 미국의 최고 명문 대학으로 진학하는 웰튼 아카데미, 전원 기숙사 생활을 하면서 철저하고 엄격한 교육을 받는 영재 고등학교다. 목표는 오직 명문대 진학. 학생들에게 스스로의 결정과 판단이란 존재하지 않는다. 목표 설정과, 그 목표에 대한 정당성은 학교와 부모가 내려줄 뿐이다. 그런 웰튼 아카데미에 존 키팅이 국어 교사로 부임하면서 변화가 일어나기 시작한다. 키팅 역시 웰튼 아카데미 출신이지만 색다른 교육 방법으로 학생들을 사로잡는다. 앞날을 스스로 설계하고 그 방향대로 나아가는 일이야말로 세상 그 어떤 것보다 소중하다 고 가르친다. 그리고 그것이 얼마나 어려운 일인지 학생들 스스로 깨우치게 한다. 획일화되고 출세만을 고집하.."
88,89,콜레라 시대의 사랑 1,가브리엘 가르시아 마르케스,"노벨 문학상 수상 작가 가르시아 마르케스의 장편소설. 한 여자와 두 남자의 사랑을 둘러싼 사랑과 죽음,그리고 욕망의 연대기를 다룬 이 러브스토리 뒤에는 라틴아메리카 사회에 관한 강한 비판과 풍자가 숨어 있느며, 제목이 암시하는 사랑과 늙음과 질병이라는 주제와 더불어 근대화와 자살 등과같은 사회적 문제에 대한 탐구와 역시가 담겨있다."
89,90,콜레라 시대의 사랑 2,가브리엘 가르시아 마르케스,"노벨 문학상 수상 작가 가르시아 마르케스의 장편소설. 한 여자와 두 남자의 사랑을 둘러싼 사랑과 죽음,그리고 욕망의 연대기를 다룬 이 러브스토리 뒤에는 라틴아메리카 사회에 관한 강한 비판과 풍자가 숨어 있느며, 제목이 암시하는 사랑과 늙음과 질병이라는 주제와 더불어 근대화와 자살 등과같은 사회적 문제에 대한 탐구와 역시가 담겨있다."
90,91,크리스마스 캐럴,찰스 디킨스,"2003년 10월 부터 소개되었던 비룡소 클래식 여섯 번째 시리즈인 크리스마스 캐럴이 완역으로 출간되었다. 19세기를 풍미한 찰스 디킨스의 이 작품은 스크루지라는 독특하고 개성적인 인물을 창조하여 가장 유명한 크리스마스 소설이 되었다. 구두쇠 영감 스크루지가 크리스마스 유령들을 만나 자기의 과거, 현재, 미래의 모습을 보고 나서 자기의 잘못을 뉘우치고 자비롭고 너그러운 사람이 된다는 내용의 클래식 동화다."
91,92,"베로니카, 죽기로 결심하다",파울로 코엘료,"세계적 밀리언셀러 작가, '소설의 연금술사'로 불리는 파울로 코엘료의 신작 소설. 매마른 일상에 빠져 인생의 꿈을 잃어버린 베로니카는 삶을 버리고자 결심한다. 그러나 네 병의 수면제를 들이키고 다시 눈을 뜬 곳은 정신병원 '빌레트'. 그곳에서 그녀는 세상에서는 만날 수 없는 '다른' 사람들을 만나게 된다. 일주일 남짓한 생의 시간 속에서, 그리고 자신이 선택한 죽음과 선택치 않은 죽음 사이에서 사랑을 알게 되고, 생을 빛으로 채우기 시작하는데.. 명성에 걸맞는 열정이 깃든 시적인 문체로 생의 드라마을 이끄는, 작가의 능력이 돋보이는 소설이다."
92,93,영혼의 집 1,이사벨 아옌데,"미래의 일을 예지할 수 있는 클라라, 소작인의 아들을 사랑한 블랑카, 인정받지 못한 사랑에서 태어나 혁명의 시대를 헤쳐가는 알바. <영혼의 집>의 여성들은 피와 고통의 라틴 아메리카 역사 속에서 그러한 현실을 극복적으로 극복하고자 한다. 즉, 이 작품에서는 자신의 삶을 찾아가는 자유로운 여성상을 제시한다. 라틴 아메리카 최고의 작가로 평가받는 아옌데의 4대에 걸친 트루에바 가문의 사랑과 죽음, 자유와 혁명의 이야기. (제1권)"
93,94,영혼의 집 2,이사벨 아옌데,"미래의 일을 예지할 수 있는 클라라, 소작인의 아들을 사랑한 블랑카, 인정받지 못한 사랑에서 태어나 혁명의 시대를 헤쳐가는 알바. '영혼의 집'의 여성들은 피와 고통의 라틴 아메리카 역사 속에서 그러한 현실을 극복적으로 극복하고자 한다. 즉, 이 작품에서는 자신의 삶을 찾아가는 자유로운 여성상을 제시한다. 라틴 아메리카 최고의 작가로 평가받는 아옌데의 4대에 걸친 트루에바 가문의 사랑과 죽음, 자유와 혁명의 이야기. (제2권)"
94,95,흑설공주 이야기 1,바바라 G.워커,"세계적인 여성학자 바바라 G. 워커가 재해석한 신화 이야기. 이 책은 1998년 새로운 동화읽기의 시초가 되었던 『흑설공주 이야기』의 후속작으로, 『흑설공주 이야기』속에 수록되었던 내용 중 신화부분만 따로 떼어 출간했던 『바다 마녀를 사랑한 남자』의 개정판이다. 이 책에 등장하는 여신들은 기존 신화에서 남성을 중심으로 짜여진 신들의 세계를 새롭게 바꾸어나간다. 선과 악, 생명과 죽음, 남성과 여성, 귀족과 평민, 신과 인간 등 세계를 이해하는 기존의 이분법적 틀을 해체하고 전혀 새로운 시각으로 옛 이야기를 재해석하는 신선한 상상력이 돋보인다."
95,96,연금술사,파울로 코엘료,"전세계 8천 5백만 독자가 읽은 전설적인 베스트셀러마음의 목소리에 귀기울이는 것이 얼마나 중요한지 증언하는 고귀한 성서, 진정 자기 자신의 꿈과 대면하고자 하는 모든 이를 축복하는 희망과 환희의 메시지, 세계적인 밀리언셀러 작가 파울로 코엘료의 『연금술사』가 신작 『히피』 출간과 함께 새로운 표지로 선보인다. 현재까지 전세계 81개 언어로 번역되어 8천 5백만 독자의 사랑을 받았고, 2009년 ‘한 권의 책이 가장 많은 언어로 번역된 작가’로 기네스북에 기록된 『연금술사』는 파울로 코엘료가 명실상부 세계적 작가의 명성을 얻게 한 작품이다. 주인공 양치기 산티아고를 중심으로 영혼의 연금술이라는 주제를 간명하게 표현한 이번 특별판은 2018년 12월부터 한정 수량으로 판매된다."
96,97,괭이부리말 아이들,김중미,"제4회 '좋은 어린이책' 원고공모 창작부문 대상 수상작으로, 창비아동문고로 선보여 독자들과 평단의 호평을 받은 바 있는 작품으로, 어린이뿐 아니라 청소년 및 성인 독자들도 읽을 수 있도록 양장본으로 새로이 선보인다. 또한 2001년 11월부터 방송되는 MBC의 새 오락프로그램 '느낌표'의 '책 책 책! 책을 읽읍시다!' 코너에서 국민필독서로 선정되어, 한층 많은 독자들에게 사랑받을 것으로 기대된다. '느낌표'는 '이경규가 간다' '칭찬합시다' 등 공익성이 강한 오락프로그램을 만들어온 MBC TV의 김영희PD가 영국유학을 마치고 돌아와 새로 만드는 프로그램으로, 이경규, 김용만, 신동엽, 유재석, 박경림 등 모두 다섯명의 인기 정상 MC들이 각자 개성을 발휘한 한 꼭지씩을 맡아 진행한다. 오락프로그램이지만 공.."
97,98,거미 여인의 키스,마누엘 푸익,"마르케스 이후 라틴 아메리카문학 최고의 문제작. 비좁고 음습한 감방, 낭만적인 동성애자와 냉소적인 게릴라의 만남, 싸구려 멜로 드라마를 매개로 펼쳐지는 성과 억압, 사랑과 편견, 자유와 폭력에 대해 들려주는 매혹적인 장편 소설."
98,99,백년의 고독 1,가브리엘 가르시아 마르케스,1982년 노벨문학상 수상작가의 세계적 장편소설. 라틴아메리카 대륙이 겪어야했던 역사의 리얼리티를 소멸 해가는 부엔디아 가문의 운명과 함께 들려주는 작품으로 블랙유머와 패러디를 통해 거센 운명의 역사를 헤 쳐 나가는 인물군상의 역정을 드라마틱하게 그렸다.
99,100,백년의 고독 2,가브리엘 가르시아 마르케스,"1982년 노벨문학상 수상작! 마술적 리얼리즘의 극치를 보여 주며 일단 한 번 잡기 시작하면 끝까지 손을 놓을 수 없게 하는 소설이다. 창세기의 역사와 라틴아메리카의 역사를 융합하여 인류 최후의 비극적 서사시를 빚어내고 있다. 라틴아메리카의 역사를 알려면 딱딱한 역사책 대신 《백 년 동안의 고독》을 읽으라는 말이 있을 정도로 이 작품은 라틴아메리카에서 일어난 실제 사건을 배경으로 사회적 이중성을 적나라하게 파헤친다.소설의 이야기는 호세 아르카디오 부엔디아와 그의 사촌 여동생 우르슬라와의 근친상간적 결혼생활로부터 시작된다. 그들은 남미의 처녀림 속에 마콘도라는 새로운 마을을 건설하는데, 이 원시적인 마을은 물질문명의 혜택을 누리는 번화한 도시로 발전했다가 무지개처럼 하루아침에 지상에서 사.."
